Title,Date,Rating,Review
Excellent neighborhood bistro,2025-02-25,5,"The roasted chicken had crisp skin and juicy meat, and the seasonal vegetables were actually seasoned well."
Slow service at lunch,2025-04-17,2,We waited nearly 40 minutes for sandwiches even though the dining room was half empty. Food was fine but not worth the delay.
Great date-night atmosphere,2025-05-19,5,"Warm lighting, attentive service, and a really balanced wine list made this feel special without being too formal."
Decent but overpriced,2025-01-09,3,"The pasta was tasty, but portions were small for the price. I expected more at this price point."
Best burger in the area,2025-12-17,5,"Perfect medium cook, toasted bun, and fries that stayed crisp to the end. Easily one of the better burgers nearby."
Mediocre brunch,2025-02-15,3,"Pancakes were fluffy but bland, and coffee arrived lukewarm. Not bad, just not memorable."
Fantastic vegetarian options,2025-02-24,4,The menu had multiple thoughtful vegetarian dishes instead of one token salad. The mushroom ravioli was excellent.
Too salty,2025-06-05,2,Both the soup and the main dish were heavily salted. I couldn't finish either.
Consistently solid,2025-09-08,4,I've been here four times this year and quality has been stable each visit. Good choice for a reliable dinner.
Amazing seafood,2025-03-26,5,"The grilled octopus was tender and smoky, and the fish special tasted very fresh."
Noisy dining room,2025-01-24,3,"Food quality was good, but the room acoustics made conversation difficult."
Great value lunch combo,2025-11-13,5,"Soup, half sandwich, and drink for a fair price. Fast enough for a work break."
Undercooked rice,2025-10-13,2,"The paella flavors were there, but the rice in the center was still firm."
Excellent hospitality,2025-08-01,5,Staff handled our allergy request carefully and checked ingredients with the kitchen right away.
Dry chicken sandwich,2025-02-24,2,"The seasoning was fine, but the chicken breast was overcooked and dry."
Strong cocktail program,2025-12-20,4,The bartender clearly knew what they were doing. Balanced drinks and good recommendations.
Perfectly cooked salmon,2025-10-24,5,"Crispy skin, moist center, and a bright lemon caper sauce that tied everything together."
Average takeout,2025-02-13,3,"Food traveled okay, but fries were soft by the time we got home. Good flavor overall."
Outstanding tacos,2025-06-30,5,House tortillas were fresh and had great texture. Al pastor had a nice char and sweetness.
Inattentive service,2025-04-27,2,We had to ask twice for water refills and waited a long time to get the check.
Comfort food done right,2025-04-23,4,Meatloaf and mashed potatoes tasted homemade in the best way. Rich gravy and good portions.
Burnt pizza crust,2025-01-19,2,"The toppings were good, but the bottom crust was charred enough to taste bitter."
Creative seasonal menu,2025-04-26,5,The squash gnocchi with brown butter and sage was rich but balanced.
Good for groups,2025-05-07,4,Service managed our table of ten well and courses came out surprisingly synchronized.
Tiny dessert portion,2025-10-07,3,"The chocolate tart was delicious, but the slice was much smaller than expected."
Excellent ramen,2025-09-08,5,"Broth had depth, noodles had bite, and the marinated egg was perfectly cooked."
Bland stir-fry,2025-09-08,2,"Fresh vegetables, but sauce lacked depth and seasoning. Needed more heat and acid."
Great patio seating,2025-11-07,4,Comfortable setup and attentive outdoor service. Nice spot on a warm evening.
Memorable anniversary dinner,2025-05-29,5,"Thoughtful pacing, polished service, and a standout ribeye made for a great celebration meal."
Unbalanced flavors,2025-12-17,3,Some dishes were too acidic while others were flat. Kitchen execution felt inconsistent.
Top-notch fried chicken,2025-11-21,5,"Crispy crust, juicy interior, and sides that didn't feel like an afterthought."
Rushed experience,2025-01-27,2,"Appetizer and main landed almost at the same time, and we felt pushed through the meal."
Great espresso,2025-08-30,4,"Flat white was smooth and well-textured, and pastries tasted fresh in the afternoon."
Excellent pho,2025-05-06,5,"Clear aromatic broth, tender beef, and very fresh herbs on the side."
Disappointing host interaction,2025-08-22,2,Front desk was abrupt and dismissive when we asked about wait times.
Very fresh ingredients,2025-10-14,5,You can taste that produce is fresh and local. Salads were crisp and thoughtfully dressed.
Reliable chain alternative,2025-08-01,3,"Better than most chain options around, though menu choices are pretty safe."
Great happy hour,2025-09-04,4,Reasonable prices and shareable portions. The crispy cauliflower was a table favorite.
Outstanding dumplings,2025-06-02,5,"Thin wrappers, juicy filling, and a vinegar dip with real complexity."
Soggy fries,2025-05-18,2,"Burger was solid, but fries arrived limp and cool."
Balanced tasting menu,2025-03-12,5,"Each course had a clear purpose, and portions were just right for the progression."
Okay but forgettable,2025-10-21,3,"No major issues, just nothing that stood out enough to bring us back soon."
Best soup this season,2025-11-17,5,Tomato bisque had deep roasted flavor and silky texture. Great with grilled cheese.
Overly sweet sauce,2025-08-08,2,Barbecue glaze tasted more like syrup than sauce and overwhelmed the meat.
Excellent service recovery,2025-11-24,4,"Kitchen missed one item, but staff fixed it quickly and comped dessert."
Great noodle texture,2025-05-30,4,Hand-pulled noodles had a satisfying chew and held up well in broth.
Perfect fish and chips,2025-04-19,5,"Light crispy batter and flaky fish, with fries that were hot and crunchy."
Crowded and cramped,2025-12-22,3,"Food was good, but tables were too close together for comfort."
Outstanding hospitality,2025-05-09,5,"Server remembered our dietary note from a prior visit, which was impressive."
Mushy vegetables,2025-04-10,2,"Protein was fine, but vegetables were overcooked and lacked texture."
Great value dinner special,2025-12-03,5,"Three courses for a fair price, and every dish was well executed."
Forgot an entree,2025-11-27,1,"One dish never came until everyone else finished. Staff apologized, but timing ruined the experience."
Excellent sandwiches,2025-12-18,4,"Fresh bread, generous fillings, and house pickles that added the right crunch."
Perfectly seared steak,2025-10-01,5,"Strong crust, medium-rare center exactly as requested, and a peppercorn sauce with depth."
Inconsistent portions,2025-09-05,3,Two of us ordered the same dish and portions looked noticeably different.
Great desserts,2025-01-24,5,Cheesecake had excellent texture and balanced sweetness.
Too much oil,2025-08-15,2,"The fried items were greasy and heavy, suggesting the oil needed to be changed."
Nice local spot,2025-01-15,4,"Not flashy, but dependable food and genuinely friendly staff."
Excellent brisket,2025-01-08,5,"Tender slices, good bark, and smoke flavor that wasn't overpowering."
Average experience,2025-07-31,3,"Reasonable meal overall, just didn't leave a strong impression."
Outstanding weekend brunch,2025-09-30,5,Eggs were perfectly cooked and the potatoes were crisp and well-seasoned.
